{
  "source": "spotify",
  "exported_at": "2023-10-27T14:32:00Z",
  "user_id": "demo_user_01",
  "tracks": [
    {
      "track_name": "Blinding Lights",
      "artist_name": "The Weeknd",
      "album_name": "After Hours",
      "genres": ["pop", "synthwave", "r&b"],
      "played_at": "2023-10-27T10:15:00Z",
      "duration_ms": 200040,
      "audio_features": {
        "energy": 0.73,
        "valence": 0.33,
        "danceability": 0.51,
        "tempo": 171.0,
        "acousticness": 0.001,
        "instrumentalness": 0.0001
      },
      "time_range": "short_term"
    },
    {
      "track_name": "Starboy",
      "artist_name": "The Weeknd",
      "album_name": "Starboy",
      "genres": ["pop", "r&b", "electronic"],
      "played_at": "2023-10-26T18:45:00Z",
      "duration_ms": 230453,
      "audio_features": {
        "energy": 0.59,
        "valence": 0.49,
        "danceability": 0.68,
        "tempo": 186.0,
        "acousticness": 0.14,
        "instrumentalness": 0.000006
      },
      "time_range": "short_term"
    },
    {
      "track_name": "Midnight City",
      "artist_name": "M83",
      "album_name": "Hurry Up, We're Dreaming",
      "genres": ["electronic", "synthwave", "indie"],
      "played_at": "2023-10-25T22:30:00Z",
      "duration_ms": 243000,
      "audio_features": {
        "energy": 0.71,
        "valence": 0.22,
        "danceability": 0.58,
        "tempo": 105.0,
        "acousticness": 0.04,
        "instrumentalness": 0.13
      },
      "time_range": "short_term"
    },
    {
      "track_name": "Nightcall",
      "artist_name": "Kavinsky",
      "album_name": "OutRun",
      "genres": ["synthwave", "electronic", "french house"],
      "played_at": "2023-09-15T23:15:00Z",
      "duration_ms": 259000,
      "audio_features": {
        "energy": 0.62,
        "valence": 0.38,
        "danceability": 0.65,
        "tempo": 97.0,
        "acousticness": 0.02,
        "instrumentalness": 0.31
      },
      "time_range": "long_term"
    },
    {
      "track_name": "Resonance",
      "artist_name": "HOME",
      "album_name": "Odyssey",
      "genres": ["synthwave", "electronic", "chillwave"],
      "played_at": "2023-08-10T21:00:00Z",
      "duration_ms": 212000,
      "audio_features": {
        "energy": 0.51,
        "valence": 0.63,
        "danceability": 0.59,
        "tempo": 100.0,
        "acousticness": 0.15,
        "instrumentalness": 0.88
      },
      "time_range": "long_term"
    },
    {
      "track_name": "The Less I Know The Better",
      "artist_name": "Tame Impala",
      "album_name": "Currents",
      "genres": ["indie", "psychedelic", "alternative"],
      "played_at": "2023-10-20T14:20:00Z",
      "duration_ms": 216000,
      "audio_features": {
        "energy": 0.74,
        "valence": 0.62,
        "danceability": 0.64,
        "tempo": 117.0,
        "acousticness": 0.01,
        "instrumentalness": 0.03
      },
      "time_range": "medium_term"
    }
  ]
}
